{
  "schema": "intentproof.flow.v1",
  "flow_id": "flow_reference_template_happy_path",
  "tenant_id": "reference",
  "provenance_class": "platform_attested",
  "correlation_id": "corr_reference_template_happy_path",
  "window": {
    "opened_at": "2026-05-16T00:00:00.000Z",
    "closed_at": "2026-05-16T00:01:00.000Z",
    "closure_reason": "idle_timeout"
  },
  "events": [
    {
      "event_id": "evt_template_action_complete",
      "ordinal": 1,
      "hash": "sha256:1111111111111111111111111111111111111111111111111111111111111111"
    }
  ],
  "instrumentation_mode": "minimal",
  "flow_merkle_root": "sha256:2222222222222222222222222222222222222222222222222222222222222222",
  "snapshot_uri": "ipfs://reference/templates/minimal-required/v1/happy-path"
}
