{
  "schema": "intentproof.flow.v1",
  "flow_id": "flow_reference_high_stakes_tool_missing_approval",
  "tenant_id": "reference",
  "provenance_class": "platform_attested",
  "correlation_id": "corr_reference_high_stakes_tool_missing_approval",
  "window": {
    "opened_at": "2026-05-16T00:00:00.000Z",
    "closed_at": "2026-05-16T00:01:00.000Z",
    "closure_reason": "idle_timeout"
  },
  "events": [
    {
      "event_id": "evt_ai_tool_request_ok",
      "ordinal": 1,
      "hash": "sha256:6666666666666666666666666666666666666666666666666666666666666666"
    },
    {
      "event_id": "evt_ai_tool_execute_ok",
      "ordinal": 2,
      "hash": "sha256:7777777777777777777777777777777777777777777777777777777777777777"
    }
  ],
  "instrumentation_mode": "operational",
  "flow_merkle_root": "sha256:8888888888888888888888888888888888888888888888888888888888888888",
  "snapshot_uri": "ipfs://reference/ai-agent/high-stakes-tool-use/v1/missing-approval"
}
