{
  "schema": "intentproof.flow.v1",
  "flow_id": "flow_reference_customer_sla_within_sla",
  "tenant_id": "reference",
  "provenance_class": "platform_attested",
  "correlation_id": "corr_reference_customer_sla_within_sla",
  "window": {
    "opened_at": "2026-05-16T00:00:00.000Z",
    "closed_at": "2026-05-16T00:10:00.000Z",
    "closure_reason": "completed"
  },
  "events": [
    {
      "event_id": "evt_notifications_customer_sla_open_ok",
      "ordinal": 1,
      "hash": "sha256:1111111111111111111111111111111111111111111111111111111111111111"
    },
    {
      "event_id": "evt_notifications_customer_sla_notify_ok",
      "ordinal": 2,
      "hash": "sha256:2222222222222222222222222222222222222222222222222222222222222222"
    }
  ],
  "instrumentation_mode": "operational",
  "flow_merkle_root": "sha256:3333333333333333333333333333333333333333333333333333333333333333",
  "snapshot_uri": "ipfs://reference/notifications/customer-sla/v1/within-sla"
}
