{
  "schema": "intentproof.flow.v1",
  "flow_id": "flow_reference_capture_settlement_happy_path",
  "tenant_id": "reference",
  "provenance_class": "platform_attested",
  "correlation_id": "corr_reference_capture_settlement_happy_path",
  "window": {
    "opened_at": "2026-05-16T00:00:00.000Z",
    "closed_at": "2026-05-16T00:01:00.000Z",
    "closure_reason": "idle_timeout"
  },
  "events": [
    {
      "event_id": "evt_capture_execute_ok",
      "ordinal": 1,
      "hash": "sha256:aaaaaaaaaaaaaaaaaaaaaaaaaaaaaaaaaaaaaaaaaaaaaaaaaaaaaaaaaaaaaaaa"
    },
    {
      "event_id": "evt_settlement_capture_record_ok",
      "ordinal": 2,
      "hash": "sha256:bbbbbbbbbbbbbbbbbbbbbbbbbbbbbbbbbbbbbbbbbbbbbbbbbbbbbbbbbbbbbbbb"
    }
  ],
  "instrumentation_mode": "operational",
  "flow_merkle_root": "sha256:cccccccccccccccccccccccccccccccccccccccccccccccccccccccccccccccc",
  "snapshot_uri": "ipfs://reference/payments/capture-settlement/v1/happy-path"
}
