{
  "schema": "intentproof.flow.v1",
  "flow_id": "flow_reference_dispute_evidence_missing_evidence",
  "tenant_id": "reference",
  "provenance_class": "platform_attested",
  "correlation_id": "corr_reference_dispute_evidence_missing_evidence",
  "window": {
    "opened_at": "2026-05-16T00:00:00.000Z",
    "closed_at": "2026-05-16T00:01:00.000Z",
    "closure_reason": "idle_timeout"
  },
  "events": [
    {
      "event_id": "evt_dispute_open_ok",
      "ordinal": 1,
      "hash": "sha256:6666666666666666666666666666666666666666666666666666666666666666"
    }
  ],
  "instrumentation_mode": "operational",
  "flow_merkle_root": "sha256:7777777777777777777777777777777777777777777777777777777777777777",
  "snapshot_uri": "ipfs://reference/payments/dispute-evidence/v1/missing-evidence"
}
