{
  "schema": "intentproof.flow.v1",
  "flow_id": "flow_reference_customer_sla_late_notification",
  "tenant_id": "reference",
  "provenance_class": "platform_attested",
  "correlation_id": "corr_reference_customer_sla_late_notification",
  "window": {
    "opened_at": "2026-05-16T00:00:00.000Z",
    "closed_at": "2026-05-16T00:30:00.000Z",
    "closure_reason": "completed"
  },
  "events": [
    {
      "event_id": "evt_notifications_customer_sla_open_ok",
      "ordinal": 1,
      "hash": "sha256:5555555555555555555555555555555555555555555555555555555555555555"
    },
    {
      "event_id": "evt_notifications_customer_sla_notify_ok",
      "ordinal": 2,
      "hash": "sha256:6666666666666666666666666666666666666666666666666666666666666666"
    }
  ],
  "instrumentation_mode": "operational",
  "flow_merkle_root": "sha256:7777777777777777777777777777777777777777777777777777777777777777",
  "snapshot_uri": "ipfs://reference/notifications/customer-sla/v1/late-notification"
}
